{
  "metadata": {
    "schema_version": "2.0",
    "content_version": "1.0",
    "revision": 1,
    "generated_by": {
      "type": "ai",
      "provider": "deepseek",
      "model": "deepseek-chat"
    }
  },
  "episode_id": "travel_new_york_city_ep001",
  "scene_id": "S002",
  "shot_id": "SHOT_003",
  "sequence": 3,
  "duration_seconds": 8.0,
  "location_ref": "LOC_JFK_AIRPORT_001",
  "character_refs": [
    "CHAR_JIEUN_001",
    "B"
  ],
  "visual_intent": "Show the airport employee pointing toward the line on the left for visitors while Jieun listens and asks about forms.",
  "framing": {
    "shot_size": "medium",
    "subject_priority": [
      "B",
      "CHAR_JIEUN_001"
    ]
  },
  "camera": {
    "angle": "eye_level",
    "movement": "static",
    "stability": "locked"
  },
  "action": {
    "primary_actor_ref": "B",
    "description": "The airport employee points toward the line on the left and tells Jieun it is for visitors, then responds to her question about forms.",
    "start_state": [
      "The employee is facing Jieun",
      "Jieun is listening to the employee"
    ],
    "end_state": [
      "The employee has pointed toward the left line",
      "Jieun has asked about forms and received an answer"
    ]
  },
  "emotion": {
    "primary_actor": "helpful and professional",
    "supporting": {
      "CHAR_JIEUN_001": "attentive and relieved"
    }
  },
  "props": [
    {
      "prop_id": "PROP_BACKPACK_001",
      "state": "worn on back",
      "visible": true
    },
    {
      "prop_id": "PROP_CROSSBODY_BAG_001",
      "state": "worn across body",
      "visible": true
    }
  ],
  "dialogue_alignment": {
    "line_ids": [
      "L003",
      "L004",
      "L005",
      "L006"
    ],
    "speaker_focus": "B"
  },
  "continuity": {
    "carry_in": [
      "Jieun is standing near the airport employee",
      "The employee has asked if she is a visitor or resident"
    ],
    "carry_out": [
      "The employee has pointed toward the left line",
      "Jieun knows she needs to have her passport ready"
    ],
    "must_match_previous_shot": true
  },
  "constraints": {
    "preserve_character_identity": true,
    "preserve_location_identity": true,
    "preserve_prop_state": true,
    "allow_new_characters": false,
    "allow_new_locations": false,
    "allow_story_changes": false
  }
}
