{
  "metadata": {
    "schema_version": "2.0",
    "content_version": "1.0",
    "revision": 1,
    "generated_by": {
      "type": "ai",
      "provider": "deepseek",
      "model": "deepseek-chat"
    }
  },
  "episode_id": "travel_new_york_city_ep001",
  "scene_id": "S016",
  "shot_id": "SHOT_004",
  "sequence": 4,
  "duration_seconds": 5.0,
  "location_ref": "LOC_MANHATTAN_HOTEL_001",
  "character_refs": [
    "CHAR_JIEUN_001"
  ],
  "visual_intent": "Show Jieun smiling, thanking the employee, and walking toward the elevator with her luggage.",
  "framing": {
    "shot_size": "medium_wide",
    "subject_priority": [
      "CHAR_JIEUN_001"
    ]
  },
  "camera": {
    "angle": "three_quarter",
    "movement": "tracking",
    "stability": "smooth"
  },
  "action": {
    "primary_actor_ref": "CHAR_JIEUN_001",
    "description": "Jieun smiles, thanks the employee, and begins walking toward the elevator with her luggage.",
    "start_state": [
      "Jieun is holding her room key",
      "She is standing at the front desk facing the employee"
    ],
    "end_state": [
      "Jieun is walking toward the elevator with her luggage",
      "She is holding her room key",
      "She has a relieved and happy expression"
    ]
  },
  "emotion": {
    "primary_actor": "relieved and happy",
    "supporting": {}
  },
  "props": [
    {
      "prop_id": "PROP_BACKPACK_001",
      "state": "worn on Jieun's back",
      "visible": true
    },
    {
      "prop_id": "PROP_CROSSBODY_BAG_001",
      "state": "worn across Jieun's body",
      "visible": true
    },
    {
      "prop_id": "PROP_LUGGAGE_001",
      "state": "being pulled by Jieun",
      "visible": true
    },
    {
      "prop_id": "PROP_ROOM_KEY_001",
      "state": "held in Jieun's hand",
      "visible": true
    }
  ],
  "continuity": {
    "carry_in": [
      "Jieun is holding her room key",
      "The front desk employee has pointed toward the elevator",
      "Jieun is still carrying her backpack, crossbody bag, smartphone, passport, and checked suitcase"
    ],
    "carry_out": [
      "Jieun is walking toward the elevator with her luggage",
      "She is holding her room key",
      "She has a relieved and happy expression",
      "She is still carrying her backpack, crossbody bag, smartphone, passport, and checked suitcase"
    ],
    "must_match_previous_shot": true
  },
  "constraints": {
    "preserve_character_identity": true,
    "preserve_location_identity": true,
    "preserve_prop_state": true,
    "allow_new_characters": false,
    "allow_new_locations": false,
    "allow_story_changes": false
  }
}
