{
  "metadata": {
    "schema_version": "2.0",
    "content_version": "1.0",
    "revision": 1,
    "generated_by": {
      "type": "ai",
      "provider": "deepseek",
      "model": "deepseek-chat"
    }
  },
  "episode_id": "travel_new_york_city_ep001",
  "scene_id": "S017",
  "shot_id": "SHOT_001",
  "sequence": 1,
  "duration_seconds": 6.0,
  "location_ref": "LOC_MANHATTAN_HOTEL_001",
  "character_refs": [
    "CHAR_JIEUN_001"
  ],
  "visual_intent": "Show Jieun entering her hotel room and looking around the clean, comfortable space.",
  "framing": {
    "shot_size": "medium_wide",
    "subject_priority": [
      "CHAR_JIEUN_001",
      "hotel room interior"
    ]
  },
  "camera": {
    "angle": "eye_level",
    "movement": "follow",
    "stability": "smooth"
  },
  "action": {
    "primary_actor_ref": "CHAR_JIEUN_001",
    "description": "Jieun enters the hotel room from the hallway, pulling her suitcase and looking around the room with a relieved expression.",
    "start_state": [
      "Jieun is entering the hotel room from the hallway",
      "She is pulling her checked suitcase and wearing her backpack",
      "She has a relieved and happy expression"
    ],
    "end_state": [
      "Jieun is standing inside the room, looking around at the clean interior",
      "She is still holding her suitcase handle and wearing her backpack"
    ]
  },
  "emotion": {
    "primary_actor": "relieved and happy",
    "supporting": {}
  },
  "props": [
    {
      "prop_id": "PROP_BACKPACK_001",
      "state": "worn on Jieun's back",
      "visible": true
    },
    {
      "prop_id": "PROP_CROSSBODY_BAG_001",
      "state": "worn across Jieun's body",
      "visible": true
    },
    {
      "prop_id": "PROP_LUGGAGE_001",
      "state": "being pulled by Jieun",
      "visible": true
    },
    {
      "prop_id": "PROP_ROOM_KEY_001",
      "state": "held in Jieun's hand",
      "visible": true
    }
  ],
  "dialogue_alignment": {
    "line_ids": [
      "L001"
    ],
    "speaker_focus": "A"
  },
  "continuity": {
    "carry_in": [
      "Jieun has checked in successfully and received her room key",
      "She is now heading to the elevator to go to her room",
      "She feels relieved and happy",
      "She is still carrying her backpack, crossbody bag, smartphone, passport, and checked suitcase",
      "She is holding her room key"
    ],
    "carry_out": [
      "Jieun is standing inside her hotel room",
      "She is still holding her suitcase handle and wearing her backpack",
      "She has a relieved and happy expression"
    ],
    "must_match_previous_shot": true
  },
  "constraints": {
    "preserve_character_identity": true,
    "preserve_location_identity": true,
    "preserve_prop_state": true,
    "allow_new_characters": false,
    "allow_new_locations": false,
    "allow_story_changes": false
  }
}
